.kh	.kh	1.8
.kh – domena internetową przypisaną dla stron internetowych z Kambodży .	.kh je necowo důmyna , kero je złůnaczůno lo neczajtůw s Kambodże .	0.7625
Nazwa pochodzi od największej grupy etnicznej kraju – Khmerów .		-0.3
Dawniej , od 1998 roku była przyznawana przez Ministerstwo Poczty i Telekomunikacji Kambodży .	Adresy zajtůw sům dowane bez Mińisteryjo Poczty a Telekůmůńikacyje .	0.735455
Od września 2012 roku ta domena jest administrowana przez Regulatora Telekomunikacyjnego Kambodży .	Pjyrszo zajta s kůńcym .kh zrobjyli we 1996 roku .	0.516883
		0.3
